question_number,question,question_type,user_answer,correct_answer,is_correct,options
1,What is the primary function of the mitochondria in a cell?,MCQ,Producing glycogen from glucose,Generating energy through cellular respiration,False,"['Producing glycogen from glucose', 'Generating energy through cellular respiration', 'Synthesizing proteins from amino acids', 'Regulating cell growth and division']"
2,What is the process by which plants convert light energy into chemical energy?,MCQ,Respiration,Photosynthesis,False,"['Respiration', 'Photosynthesis', 'Decomposition', 'Fermentation']"
3,What is the primary function of a capacitor in a electronic circuit?,MCQ,To amplify the voltage of the signal,To store and regulate electrical energy,False,"['To amplify the voltage of the signal', 'To generate a magnetic field', 'To store and regulate electrical energy', 'To convert AC to DC power']"
4,What is the primary function of the mitochondria in a cell?,MCQ,To synthesize proteins,To generate energy for the cell,False,"['To synthesize proteins', 'To store genetic information', 'To generate energy for the cell', 'To regulate cell growth']"
5,What is the process by which plants convert sunlight into energy?,MCQ,Respiration,Photosynthesis,False,"['Respiration', 'Photosynthesis', 'Decomposition', 'Fermentation']"
